{
    "ok": true,
    "stage": "optimizer+audit+charts",
    "meta": {
        "algo": "TRI>ROI>Gains25 + Autoprod",
        "tarifs_effectifs": {
            "mode": "base",
            "effective_price": 0.1952,
            "oa_enabled": true,
            "tempo": false,
            "tempo_avg": null
        },
        "oa": {
            "enabled": true,
            "rate_upto_9": 0.04,
            "rate_above_9": 0.0617
        },
        "battery_config": {
            "enabled": false,
            "unit_kwh": 7,
            "unit_price_ht": 3750,
            "max_units": 3,
            "units_requested": 0
        }
    },
    "selection": {
        "A": {
            "panneaux": 6,
            "kwc": 2.91,
            "variante": "sans_batterie",
            "capex": 5500
        },
        "B": {
            "panneaux": 12,
            "kwc": 5.82,
            "variante": "sans_batterie",
            "capex": 9000
        }
    },
    "scenario_gagnant": {
        "code": "A1",
        "raison": "max TRI puis ROI puis Gains25"
    },
    "scenario_forced": null,
    "scenarios": {
        "A1": {
            "label": "A1",
            "annee1": {
                "mois": [
                    {
                        "mois": "Jan",
                        "prod": 220,
                        "conso": 950,
                        "autoconso": 220,
                        "surplus": 0,
                        "import": 730,
                        "eco_eur": 42.94,
                        "oa_eur": 0
                    },
                    {
                        "mois": "Fév",
                        "prod": 260,
                        "conso": 820,
                        "autoconso": 260,
                        "surplus": 0,
                        "import": 560,
                        "eco_eur": 50.75,
                        "oa_eur": 0
                    },
                    {
                        "mois": "Mar",
                        "prod": 350,
                        "conso": 750,
                        "autoconso": 350,
                        "surplus": 0,
                        "import": 400,
                        "eco_eur": 68.32,
                        "oa_eur": 0
                    },
                    {
                        "mois": "Avr",
                        "prod": 420,
                        "conso": 720,
                        "autoconso": 420,
                        "surplus": 0,
                        "import": 300,
                        "eco_eur": 81.98,
                        "oa_eur": 0
                    },
                    {
                        "mois": "Mai",
                        "prod": 520,
                        "conso": 680,
                        "autoconso": 520,
                        "surplus": 0,
                        "import": 160,
                        "eco_eur": 101.5,
                        "oa_eur": 0
                    },
                    {
                        "mois": "Jun",
                        "prod": 580,
                        "conso": 640,
                        "autoconso": 580,
                        "surplus": 0,
                        "import": 60,
                        "eco_eur": 113.22,
                        "oa_eur": 0
                    },
                    {
                        "mois": "Jul",
                        "prod": 600,
                        "conso": 630,
                        "autoconso": 600,
                        "surplus": 0,
                        "import": 30,
                        "eco_eur": 117.12,
                        "oa_eur": 0
                    },
                    {
                        "mois": "Aoû",
                        "prod": 560,
                        "conso": 650,
                        "autoconso": 560,
                        "surplus": 0,
                        "import": 90,
                        "eco_eur": 109.31,
                        "oa_eur": 0
                    },
                    {
                        "mois": "Sep",
                        "prod": 480,
                        "conso": 700,
                        "autoconso": 480,
                        "surplus": 0,
                        "import": 220,
                        "eco_eur": 93.7,
                        "oa_eur": 0
                    },
                    {
                        "mois": "Oct",
                        "prod": 360,
                        "conso": 760,
                        "autoconso": 360,
                        "surplus": 0,
                        "import": 400,
                        "eco_eur": 70.27,
                        "oa_eur": 0
                    },
                    {
                        "mois": "Nov",
                        "prod": 240,
                        "conso": 880,
                        "autoconso": 240,
                        "surplus": 0,
                        "import": 640,
                        "eco_eur": 46.85,
                        "oa_eur": 0
                    },
                    {
                        "mois": "Déc",
                        "prod": 200,
                        "conso": 920,
                        "autoconso": 200,
                        "surplus": 0,
                        "import": 720,
                        "eco_eur": 39.04,
                        "oa_eur": 0
                    }
                ],
                "totaux": {
                    "prod": 4790,
                    "conso": 9100,
                    "autoconso": 4790,
                    "surplus": 0,
                    "import": 4310,
                    "economie_auto": 935.01,
                    "revenu_oa": 0,
                    "prime": 0
                }
            },
            "ans25": [
                {
                    "annee": 1,
                    "prod": 4790,
                    "economie_auto": 935.01,
                    "revenu_oa": 0,
                    "gains_totaux": 935.01
                },
                {
                    "annee": 2,
                    "prod": 4766.05,
                    "economie_auto": 967.55,
                    "revenu_oa": 0,
                    "gains_totaux": 967.55
                },
                {
                    "annee": 3,
                    "prod": 4742.22,
                    "economie_auto": 1001.22,
                    "revenu_oa": 0,
                    "gains_totaux": 1001.22
                },
                {
                    "annee": 4,
                    "prod": 4718.51,
                    "economie_auto": 1036.06,
                    "revenu_oa": 0,
                    "gains_totaux": 1036.06
                },
                {
                    "annee": 5,
                    "prod": 4694.92,
                    "economie_auto": 1072.11,
                    "revenu_oa": 0,
                    "gains_totaux": 1072.11
                },
                {
                    "annee": 6,
                    "prod": 4671.44,
                    "economie_auto": 1109.42,
                    "revenu_oa": 0,
                    "gains_totaux": 1109.42
                },
                {
                    "annee": 7,
                    "prod": 4648.08,
                    "economie_auto": 1148.03,
                    "revenu_oa": 0,
                    "gains_totaux": 1148.03
                },
                {
                    "annee": 8,
                    "prod": 4624.84,
                    "economie_auto": 1187.98,
                    "revenu_oa": 0,
                    "gains_totaux": 1187.98
                },
                {
                    "annee": 9,
                    "prod": 4601.72,
                    "economie_auto": 1229.32,
                    "revenu_oa": 0,
                    "gains_totaux": 1229.32
                },
                {
                    "annee": 10,
                    "prod": 4578.71,
                    "economie_auto": 1272.11,
                    "revenu_oa": 0,
                    "gains_totaux": 1272.11
                },
                {
                    "annee": 11,
                    "prod": 4555.82,
                    "economie_auto": 1316.37,
                    "revenu_oa": 0,
                    "gains_totaux": 1316.37
                },
                {
                    "annee": 12,
                    "prod": 4533.04,
                    "economie_auto": 1362.18,
                    "revenu_oa": 0,
                    "gains_totaux": 1362.18
                },
                {
                    "annee": 13,
                    "prod": 4510.37,
                    "economie_auto": 1409.59,
                    "revenu_oa": 0,
                    "gains_totaux": 1409.59
                },
                {
                    "annee": 14,
                    "prod": 4487.82,
                    "economie_auto": 1458.64,
                    "revenu_oa": 0,
                    "gains_totaux": 1458.64
                },
                {
                    "annee": 15,
                    "prod": 4465.38,
                    "economie_auto": 1509.4,
                    "revenu_oa": 0,
                    "gains_totaux": 1509.4
                },
                {
                    "annee": 16,
                    "prod": 4443.06,
                    "economie_auto": 1561.93,
                    "revenu_oa": 0,
                    "gains_totaux": 1561.93
                },
                {
                    "annee": 17,
                    "prod": 4420.84,
                    "economie_auto": 1616.29,
                    "revenu_oa": 0,
                    "gains_totaux": 1616.29
                },
                {
                    "annee": 18,
                    "prod": 4398.74,
                    "economie_auto": 1672.53,
                    "revenu_oa": 0,